{
  "$schema": "./release-manifest.schema.json",
  "repositoryVersion": "0.9.1",
  "previousRepositoryVersion": "0.9.0",
  "adoptionBaseline": false,
  "manualTransition": {
    "approved": true,
    "reason": "Jente approved the 0.9.1 invitation migration repair and its one-hop unbacked database migration."
  },
  "database": {
    "schemaVersion": "0.9.0",
    "baselinePath": "apps/opencrane/prisma/bootstrap/target-baseline.sql",
    "baselineSha256": "5e16b35aedce54bf6ff7bd79bca04f92f6b6aee6315dec5c4b4797604342ab5f",
    "carriedForwardFromRepositoryVersion": "0.8.1"
  },
  "projects": {
    "@opencrane/website": {
      "root": "website",
      "adaptedVersion": "0.9.1",
      "packageVersion": "0.9.1"
    },
    "agent-controller": {
      "root": "apps/agent-controller",
      "adaptedVersion": "0.9.1",
      "packageVersion": "0.9.1",
      "chartVersion": "0.9.1",
      "chartAppVersion": "0.9.1"
    },
    "agent-runtime": {
      "root": "apps/agent-runtime",
      "adaptedVersion": "0.8.1"
    },
    "artifact-preprocessor": {
      "root": "apps/artifact-preprocessor",
      "adaptedVersion": "0.9.1",
      "packageVersion": "0.9.1",
      "chartVersion": "0.9.1",
      "chartAppVersion": "0.9.1"
    },
    "artifact-scanner": {
      "root": "apps/artifact-scanner",
      "adaptedVersion": "0.9.1",
      "packageVersion": "0.9.1",
      "chartVersion": "0.9.1",
      "chartAppVersion": "0.9.1"
    },
    "artifact-service": {
      "root": "apps/artifact-service",
      "adaptedVersion": "0.8.0",
      "packageVersion": "0.8.0",
      "chartVersion": "0.8.0",
      "chartAppVersion": "0.8.0"
    },
    "channel-proxy": {
      "root": "apps/channel-proxy",
      "adaptedVersion": "0.8.0",
      "packageVersion": "0.8.0",
      "chartVersion": "0.8.0",
      "chartAppVersion": "0.8.0"
    },
    "cognee": {
      "root": "apps/_infra/cognee",
      "adaptedVersion": "0.8.1",
      "chartVersion": "0.8.1",
      "chartAppVersion": "0.8.1"
    },
    "deploy-k8s": {
      "root": "apps/_infra/deploy-k8s",
      "adaptedVersion": "0.9.1",
      "chartVersion": "0.9.1",
      "chartAppVersion": "0.9.1"
    },
    "litellm": {
      "root": "apps/_infra/litellm",
      "adaptedVersion": "0.8.0",
      "chartVersion": "0.8.0",
      "chartAppVersion": "0.8.0"
    },
    "managed-agent-runtime": {
      "root": "apps/managed-agent-runtime",
      "adaptedVersion": "0.8.0",
      "chartVersion": "0.8.0",
      "chartAppVersion": "0.8.0"
    },
    "memory-gateway": {
      "root": "apps/memory-gateway",
      "adaptedVersion": "0.9.1",
      "packageVersion": "0.9.1",
      "chartVersion": "0.9.1",
      "chartAppVersion": "0.9.1"
    },
    "obot": {
      "root": "apps/_infra/obot",
      "adaptedVersion": "0.8.0",
      "chartVersion": "0.8.0",
      "chartAppVersion": "0.8.0"
    },
    "opencrane": {
      "root": "apps/opencrane",
      "adaptedVersion": "0.9.1",
      "packageVersion": "0.9.1",
      "chartVersion": "0.9.1",
      "chartAppVersion": "0.9.1"
    },
    "opencrane-ui": {
      "root": "apps/opencrane-ui",
      "adaptedVersion": "0.9.1",
      "chartVersion": "0.9.1",
      "chartAppVersion": "0.9.1"
    },
    "postgres": {
      "root": "apps/postgres",
      "adaptedVersion": "0.9.1",
      "chartVersion": "0.9.1",
      "externalAppVersion": "17"
    },
    "skill-authoring": {
      "root": "apps/skill-authoring",
      "adaptedVersion": "0.8.0",
      "chartVersion": "0.8.0",
      "chartAppVersion": "0.8.0"
    },
    "tool-runner": {
      "root": "apps/tool-runner",
      "adaptedVersion": "0.8.0",
      "chartVersion": "0.8.0",
      "chartAppVersion": "0.8.0"
    }
  }
}
